<?xml version="1.0" encoding="UTF-8"?>
<Mr.Music xmlns:xsi="http://www.w3.org/2001/XMLSchema-instance" xsi:noNamespaceSchemaLocation="Song.xsd">
  <cancion anio="1975" duracion="6:00">
    <Titulo>Bohemian Rhapsody</Titulo>
    <Compositores>
      <Compositor>
        <Nombres>Freddy</Nombres>
        <Apellidos>Mercury</Apellidos>
      </Compositor>
    </Compositores>
    <Productores>
      <Productor>
        <Nombres>Reinhold Mack</Nombres>
      </Productor>
    </Productores>
    <Sello>EMI Records</Sello>
    <Artista>Queen</Artista>
  </cancion>
  <cancion anio="2012" duracion="4:55">
    <Titulo>Maquiavélico</Titulo>
    <Compositores>
      <Compositor>
        <Nombres>Tirone José</Nombres>
        <Apellidos>González Orama</Apellidos>
      </Compositor>
    </Compositores>
    <Productores>
      <Productor>
        <Nombres>Kpú</Nombres>
      </Productor>
    </Productores>
    <Sello>Independiente</Sello>
    <Artista>Canserbero</Artista>
  </cancion>
  <cancion anio="1974" duracion="3:12">
    <Titulo>Killer Queen</Titulo>
    <Compositores>
      <Compositor>
        <Nombres>Freddy</Nombres>
        <Apellidos>Mercury</Apellidos>
      </Compositor>
    </Compositores>
    <Productores>
      <Productor>
        <Nombres>Reinhold Mack</Nombres>
      </Productor>
    </Productores>
    <Sello>Parlophone</Sello>
    <Artista>Queen</Artista>
  </cancion>
</Mr.Music>
